{
  "schema_version": "aud-synthesis-result-v1", "synthesis_id": "SYN-TEST-001", "run_id": "RUN-TEST-001",
  "generated_at": "2026-09-04T10:00:00Z", "project_revision": "da063c38731f3f797bfd5000374daa5c14952782",
  "input_refs": { "audit_plan": "audit-plan.json", "run_manifest": "run-manifest.json", "project_context": "project-context.json", "task_model": null, "content_contract": null, "flow_contract": null, "capture_manifest": "capture-manifest.json", "ledger": "findings-ledger.jsonl", "specialist_findings": ["content/findings.jsonl"], "specialist_evidence": ["content/evidence.jsonl"] },
  "source_finding_refs": ["F-TEST-001"],
  "canonical_findings": [{ "canonical_id": "CANON-TEST-001", "representative_finding_id": "F-TEST-001", "source_finding_refs": ["F-TEST-001"], "source_audits": ["content-audit"], "evidence_refs": ["EV-TEST-001"], "deduplication_rationale": "Independent issue.", "combined_confidence": { "score": 0.8, "basis": "One source." } }],
  "relationships": [],
  "clusters": [{
    "schema_version": "aud-issue-cluster-v1", "cluster_id": "CLUSTER-TEST-001", "run_id": "RUN-TEST-001", "representative_finding_id": "F-TEST-001", "finding_refs": ["F-TEST-001"], "duplicate_finding_refs": [],
    "grouping": { "rationale": "Independent canonical issue.", "signals": ["independent canonical issue"] },
    "observed_symptoms": [{ "finding_id": "F-TEST-001", "claim": "The task is blocked.", "evidence_refs": ["EV-TEST-001"] }],
    "inferred_root_cause": null, "supporting_evidence_refs": ["EV-TEST-001"], "conflicting_evidence_refs": [],
    "affected": { "tasks": ["TASK-TEST-001"], "routes": ["/test"], "components": ["test-panel"], "content": [] },
    "specialist_coverage": ["functional-audit"], "root_cause_confidence": { "score": 0.3, "basis": "No cause inferred." }, "unresolved_assumptions": []
  }],
  "contradictions": [], "coverage_limitations": [], "evidence_limitations": [], "deferred_finding_refs": [], "degraded": false, "degraded_reasons": []
}
